world	AFP - The international community is "getting nowhere" with the crisis in Sudan's troubled Darfur region, the US ambassador to the United Nations, John Danforth, said.
business	WASHINGTON (Reuters) - Chiron Corp. &lt;A HREF="http://www.investor.reuters.com/FullQuote.aspx?ticker=CHIR.O target=/stocks/quickinfo/fullquote"&gt;CHIR.O&lt;/A&gt; has won a contract to develop a human vaccine against a strain of bird flu that can infect people and "has the potential to trigger a modern-day pandemic," the U.S. government said on Tuesday.
world	Israel launches psychological war against hundreds of Palestinian inmates on hunger strike for better conditions.
sports	AP - George Zahringer III is back for another shot at the U.S. Amateur. The New Yorker is one of three returning quarterfinalists for the tournament, which begins Monday at the Winged Foot Golf Club. Lee Williams of Alexander City, Ala., and Patrick Carter of Lesage, W.Va., complete the trio from last year's championship that was won by Nick Flanagan of Australia.
world	The fallout from Shiites fighting U.S. Marines in a holy city could weaken Iraq's new government
world	AP - The United Nations should find ways to demonstrate political independence, regain the neutrality it lost after the Sept. 11 attacks and better communicate with the world's 1 billion Muslims, a top U.N. official said Monday.
tech	Marshall Space Flight Center -- On August 12, 1999, NASA's Chandra X-ray Observatory opened its sunshade doors for the first time, allowing celestial X-ray light to reach the observatory's mirrors. This one small step for the observatory proved to be a giant leap for science as Chandra began its mission to shed new light on a violent, mysterious universe invisible to the human eye...
world	CARACAS -- Partisans on both sides are calling it the most polarized and important election in Venezuela's history, a presidential recall referendum today that will determine the course of democracy here and could buffet world oil prices. Both campaigns are also utterly convinced they will win.
business	Kevin B. Rollins, the new chief executive of Dell, talks about Dell's transitory slip in customer service, and why he sees a broader technology recovery taking place.
world	SAN JOSE, Calif. - In a sign that Google Inc.'s initial public offering will not be as hot or big as expected, the Internet search giant reduced the number of shares to be sold by insiders and slashed its estimated per-share price range...
sports	Friday night came as close to an old-time local battle for viewers among Channels 4, 5, and 7 as we're likely to see. It was a throwback to pre-cable, pre-dish, and even pre-UHF days as the three local quot;originals quot; served up a special night of sports programming. Although Red Sox-White Sox was on Channel 4's quot;sister quot; station, Channel 38, it ...
world	Texas authorities are investigating claims that a US mother left her seven adopted children in Nigeria and went to work in Iraq.
world	AP - Discounted hotels and Broadway show tickets for convention protesters?
world	AFP - Police discovered two bombs near the Sardinian villa of Italian Prime Minister Silvio Berlusconi, just hours after he met his British counterpart Tony Blair on the island.
business	A group led by the UAE's Etisalat plans to spend \$1bn (544m) on expansion after winning two mobile phone licences in Saudi Arabia.
world	Canadian Press - SHANGHAI, China (AP) - China has ordered severe punishment for phone sex operators as part of a sweeping crackdown on electronic pornography, Xinhua News Agency reported Wednesday.
world	CARACAS, Venezuela - The opposition's long and bitter campaign to oust Venezuelan President Hugo Chavez finally came down to a recall referendum Sunday, with the leftist leader hoping a huge turnout among the poor will keep him in power. Officials from around the world - including Pope John Paul II and U.S...
business	WASHINGTON, Aug 17 (Reuters) - Hurricane Charley may have caused up to \$15 billion in damage in Florida, but that is not seen immediately hurting the state #39;s credit picture thanks to strong finances and funds in reserve, analysts said ...
world	The Honduran government's crackdown on street gangs has been swift, severe, and apparently successful.
tech	The space shuttle's external fuel tank, implicated in the 2003 Columbia disaster, is to get its own camera.
world	NAJAF, Iraq (Reuters) - Heavy fighting broke out between US troops and Shi #39;ite militiamen in the Iraqi city of Najaf, where Iraq #39;s interim defense minister said he expected a quot;decisive battle quot; to take place on Wednesday.
sports	Treat Huey, the two-time All-Met Player of the year, suffered a 6-2, 6-0 loss to 29-year-old journeyman Mashiska Washington, the younger brother of former pro and 1996 Wimbledon finalist Malivai.
tech	PC World - Developers get early code for new operating system 'skin' still being crafted.
world	ATHENS, Greece - In an upset as historic as it was inevitable, Tim Duncan, Allen Iverson and the rest of the U.S. basketball team lost 92-73 to Puerto Rico on Sunday, only the third Olympic loss ever for America and its first since adding pros...
world	Reuters - Thousands of U.S. troops in Afghanistan\may have failed to catch Osama bin Laden but they are credited\with encouraging millions of Afghans to register for the\country's historic election in October.
world	PRIME Minister John Howard is insisting he has not deliberately misled the Australian public over the children overboard affair.
world	Kostas Kenteris and Katerina Thanou may not be fit enough to attend the hearing into their missed drugs test.
business	Blogs are the hottest thing on the Net, but are they messing with traditional publishing principles? One of the most popular, Fark.com, is allegedly selling links. Is it the wave of the future? By Daniel Terdiman.
world	AP - Maintaining that a failed referendum to oust Venezuela's president was rigged against them, opposition leaders Wednesday refused to participate in a partial audit of the results as proposed by former President Jimmy Carter.
tech	The Hubble Space Telescope has looked into a bubble of gas and dust being inflated by a young star's particles.
world	President Hugo Chavez is riding high after his overwhelming victory in a recall vote this week, but analysts say his triumph may have limited impact on the deep economic and political problems threatening this major oil-producing country.
world	BUJUMBURA/UNITED NATIONS (Reuters) - U.N. peacekeepers are scrambling to avoid new bloodshed in the volatile Great Lakes region of Africa following a massacre of Congolese refugees in western Burundi, the United Nations said on Wednesday.
business	Even though Google's two founders gave an interview to Playboy magazine in the midst of its IPO filing, the SEC allowed the company's offering to go ahead. The boys filed the interview with the SEC and corrected mistakes in it.
world	NAJAF, Iraq - Sporadic gunfire and explosions boomed through Najaf on Thursday despite a peace deal in which radical cleric Muqtada al-Sadr agreed to disarm his militiamen and pull them out of a revered Shiite shrine they've been taking refuge in. As clashes in Najaf continued, Arab television station Al-Jazeera aired a video Thursday showing a militant group that called itself the Martyrs Brigade vowing to kill a missing Western journalist if U.S...
tech	Chandra X-Ray Observatory -- A NASA Chandra X-ray Observatory image has revealed a complex of several intergalactic hot gas clouds in the process of merging. The superb Chandra spatial resolution made it possible to distinguish individual galaxies from the massive clouds of hot gas...
world	The British journalist who was kidnapped in Iraq says he faced mock executions and tried to escape his captors.
world	ATHENS, Greece - Michael Phelps took care of qualifying for the Olympic 200-meter freestyle semifinals Sunday, and then found out he had been added to the American team for the evening's 400 freestyle relay final. Phelps' rivals Ian Thorpe and Pieter van den Hoogenband and teammate Klete Keller were faster than the teenager in the 200 free preliminaries...
world	BEIJING (Reuters) - China has successfully tested a new guided missile it says is highly accurate, state media said on Tuesday amid rising tensions with arch-rival Taiwan.
world	WASHINGTON : The United States pulled its punch in Iraq as Defense Secretary Donald Rumsfeld announced US forces arrayed in Najaf against Shiite militants of firebrand cleric Moqtada Sadr were quot;unlikely quot; to storm the town #39;s holy places to deal the militia ...
tech	SPACE.com - A piloted rocket ship race to claim a #36;10 million Ansari X Prize purse for privately financed flight to the edge of space is heating up.
world	European Union governments may impose tougher conditions on entry talks with Turkey in response to demands by France, Austria and Cyprus, a draft EU compromise shows.
business	AFP - Terrorism poses the biggest short-term threat to the US economy, a panel of top business economists said in a survey.
world	BEIJING (Reuters) - China has detained eight Roman Catholic priests in northern Hebei province, continuing a crackdown on those loyal to the Pope, a U.S.-based religious right group said on Wednesday.
world	BAZARAK, Afghanistan&lt;br&gt;Like virtually every adult in this Panjshir Valley village, Rahmal Beg registered to vote weeks ago. Indeed, popular enthusiasm is so high for the Oct. 9 presidential election -- the first in Afghan history -- that thousands of people in the valley have reportedly...
world	London, Aug. 17 (Reuters): Britain charged eight men today with conspiracy to murder and other terrorism charges, some of them relating to plans of US buildings that could have been used to organise attacks.
business	Alcoa Inc. will close an automotive components factory in Ohio and lay off its staff in a bid to cut excess capacity, the Pittsburgh-based company said Tuesday.
world	Australia #39;s foreign minister is in North Korea, urging the Stalinist state to renounce nuclear weapons.
tech	AP - A company that unveiled the world's first cloned cat nearly three years ago now says it is ready to start filling orders for cloned pets, a newspaper reported Thursday.
sports	ATHENS (Reuters) - Michael Phelps, his first gold medal safely gathered in, eased through the next phase of his monumental Olympic challenge in the heats of the 200 meters freestyle Sunday but the immensity of the task ahead was clear.
tech	\\"RIYADH, Saudi Arabia (CNN) -- One of Saudi Arabia's most wanted militants has\turned himself into the authorities, the first senior suspect to surrender under\a one-month government amnesty announced last week."\\"Othman Al-Omari, number 19 on Saudi Arabia's most wanted list of 26, accepted\King Fahd's offer of amnesty, which was made last week, according to Saudi\sources Monday."\\"Al-Omari, who turned himself in on Sunday night, was a business partner of\Shaban Al Shihri -- the first al Qaeda member to accept the offer when he turned\himself in Friday."\\When I first saw this I was really upset. I thought that it would certainly\lead to more violence if they just let terrorists off the ...\\
world	TOKYO (Reuters) - Three Japanese ministers paid homage at a controversial shrine for war dead Sunday, the 59th anniversary of Japan's World War II surrender, a move that drew anger from Asian neighbors.
world	AFP - The US military denied reports that the coalition in Afghanistan had launched air strikes to quell fighting in the west of the country.
world	NEW DELHI - A bomb exploded during an Independence Day parade in India's remote northeast on Sunday, killing at least 15 people, officials said, just an hour after Prime Minister Manmohan Singh pledged to fight terrorism. The outlawed United Liberation Front of Asom was suspected of being behind the attack in Assam state and a second one later in the area, said Assam Inspector General of Police Khagen Sharma...
tech	SPACE.com - For those who want to explore Mars but cant wait for a spacecraft to take them there, NASA scientists have reformulated a website that lets the general public search data and images from previous missions.
world	Day six of the Olympics will see Great Britain's Nathan Robertson and Gail Emms go for gold in badminton.
tech	The famous Orson Welles' radio broadcast of "The War of the Worlds" is about to hit the big screen, as film moguls Spielberg and Cruise bring the H.G. Wells' classic back into the popular imagination. Are we so clever today not be duped?
world	AP - German officials voiced concern Monday that their country has the most to lose with President Bush's announcement that tens of thousands of troops will return to the United States over the next decade.
world	KATHMANDU, Nepal (Reuters) - A man on a bicycle threw at least four bombs into the compound of a luxury hotel in Nepal's capital Monday but the blasts caused no casualties, authorities said.
business	Reuters - Time is running out for prospective\investors to submit their offers to buy shares of Google Inc,\the Web's No. 1 search company.
world	AP - Hiram L. Fong, a son of immigrants who overcame poverty to become a millionaire businessman and the first Asian-American elected to the U.S. Senate, died Wednesday. He was 97.
world	One Najaf family's shifting view of the fierce fighting that surrounds them.
world	An expert has warned that landslides such as those seen this week in Perthshire and north Cornwall are set to become more common.
world	WARSAW, Aug 19 (AFP) - Two Polish soldiers serving in Iraq were killed and five injured on Thursday in a car crash as they sought to escape an ambush, a military spokesman in Warsaw said.
tech	AP - A lunar orbiter that Japan had planned to launch this year could face further delays, possibly until next year or later, because of a funding shortfall and problems developing the probe's information-gathering capabilities, Japan's space agency said Wednesday.
world	AFP - Key players in the search for Middle East peace have reached understanding on a plan that could lead to a comprehensive settlement.
business	Novell brings updated kernel to enterprise LinuxTimed to coincide with this years linuxworld expo, Novell has announced SuSE Linux Enterprise Server 9. Though Novells SuSE division has marketed a commercial Linux distribution based on the v2.6 kernel, this is the first to be granted the more stringently qualified enterprise designation. Besides kernel-level improvements and the usual collection of updated software packages, this release offers improved fail-over, clustering, and resource management and comes bundled with Novells ZENworks configuration management software for Linux. The company claims that its AutoBuild system allows it to offer identical configurations for a variety of platforms, including x86 (both 32- and 64-bit), Itanium, IBM POWER, and IBM mainframes. Free evaluation downloads are available now and support subscriptions start at \$349 per dual-CPU server.SuSE Linux Enterprise Server 9, Novell/SuSE
world	JERUSALEM (Reuters) - Israeli Prime Minister Ariel Sharon's rebellious Likud party has dealt a severe setback to his plan to withdraw from occupied Gaza by voting to bar him from forging a coalition with the Labour opposition.
business	CHICAGO (Reuters) - Krispy Kreme Doughnuts Inc. &lt;A HREF="http://www.investor.reuters.com/FullQuote.aspx?ticker=KKD.N target=/stocks/quickinfo/fullquote"&gt;KKD.N&lt;/A&gt; said on Monday that its chief operating officer is leaving the company for another job, the latest setback for a company that is trying to recover from sluggish sales and an accounting probe.
world	AP - Fraud in the #36;300-billion-a-year Medicaid program is widespread and the federal government is not doing enough to combat it, congressional investigators said in a report released Wednesday.
world	WASHINGTON - Consumer prices, which have been buffeted this year by soaring energy costs, fell by 0.1 percent in July as gasoline costs posted their biggest decline in eight months, the government reported Tuesday. The Labor Department said the decline in its closely watched Consumer Price Index was the first decrease since a 0.2 percent drop last November, a decline which also reflected a decline in energy costs...
business	Singapore real estate investment trusts such as CapitaMall Trust may outperform the market this year as acquisitions of shopping malls and industrial buildings bolster rental income.
business	NEW YORK (Reuters) - Soaring crude prices plus worries about the economy and the outlook for earnings are expected to hang over the stock market this week during the depth of the summer doldrums.
business	(Clint Willis is a freelance writer who covers mutual funds for Reuters. Any opinions in the column are solely those of Mr. Willis.)
world	BEIJING - The arrest of a Hong Kong pro-democracy candidate in mainland China on charges of soliciting a prostitute touched off a media furor in the former British colony yesterday and fueled suspicion that Beijing was trying to influence ...
world	Eight alleged terrorists were charged in Britain this week. One was caught with detailed plans of several US buildings.
world	AFP - England's marketing men must have been tempted to approach the manufacturers of Alka Seltzer, the country's favourite hangover remedy, about sponsoring the international friendly with the Ukraine.
world	LAS VEGAS - Hotel heiress Nicky Hilton married a New York money manager before dawn Sunday in an impromptu ceremony, according to court filings obtained by The Associated Press. Hilton, 20, married Todd Andrew Meister, 33, at the Las Vegas Wedding Chapel, according a Clark County marriage license...
world	LOURDES, France - A frail Pope John Paul II celebrated an open-air Mass on Sunday as several hundred thousand pilgrims, many in wheelchairs, crowded onto a field near a French shrine to the Virgin Mary that is associated with miraculous cures of the sick. The Mass was a highlight of the Pope's two-day visit to Lourdes, a town in the Pyrenees where Roman Catholic tradition says St...
world	BAGHDAD, Iraq - Radical Shiite Muslim cleric Muqtada al-Sadr, whose militia has been fighting American and Iraqi forces for almost two weeks in Najaf, agreed Wednesday to a peace plan proposed by an Iraqi national ...
business	ATLANTA (Reuters) - Lowe's Cos. &lt;A HREF="http://www.investor.reuters.com/FullQuote.aspx?ticker=LOW.N target=/stocks/quickinfo/fullquote"&gt;LOW.N&lt;/A&gt;, the world's second largest home improvement retailer, on Monday reported an 18 percent increase in second-quarter net income and said earnings for the rest of the year would top analysts' estimates.
world	Italy police defuse a bomb near Silvio Berlusconi's holiday villa, hours after a visit by the UK's Tony Blair.
world	BERLIN (Reuters) - Germany said Tuesday U.S. plans to pull out 30,000 troops were a sign Europe's divisions had healed, but communities hit by the decision warned they were headed for economic disaster.
world	AP - Democratic Party officials picked U.S. Rep. William Lipinski's son Tuesday to replace his father on the November ballot, a decision engineered by Lipinski after he announced his retirement and withdrew from the race four days earlier.
business	The Blues is alive and well in the Philippines, as evidenced by this appreciation of the Pinoy Blues band 'Lampano Alley', penned by columnist Clarence Henderson as a counterpoint to his usual economics, business, and culture fare.
business	People driving or riding in a sport utility vehicle in 2003 were nearly 11 percent more likely to die in an accident than people in cars.
world	Reuters - Developing nations launched their annual diplomatic summit on Tuesday with a plea to the United States and other powerful countries to consult them on tackling terror and resolving the Middle East conflict
tech	Reuters - Oracle Corp. sales documents\detailing highly confidential information, such as which\companies receive discounts on Oracle's business software\products and the size of the discounts, are likely to be made\public, a federal judge said on Friday.
world	AFRICAN leaders appealed to the United Nations Security Council yesterday to impose sanctions on the Burundian rebel group that claimed responsibility for the massacre of at least 160 refugees at a UN camp in Burundi.
world	CARACAS, Venezuela - Voters turned out in huge numbers Sunday to decide whether to keep populist President Hugo Chavez in power or oust him and his social revolution that critics say has sidelined the middle class and fueled tensions between rich and poor. Activists on both sides set off huge firecrackers and played recorded bugle songs to wake voters hours before dawn...
business	The purchasing power of kids is a big part of why the back-to-school season has become such a huge marketing phenomenon.
world	NAJAF, Iraq - Radical Shiite cleric Muqtada al-Sadr accepted a peace plan Wednesday for Najaf that would disarm his militiamen and remove them from a holy shrine where they are hiding out, according to a spokesman. However, Al-Sadr wanted to negotiate how the deal would be implemented...
world	An Australian court has ordered lorry driver Bradley John Murdoch to stand trial over the murder of British backpacker Peter Falconio, who has been missing for three years.
business	TORONTO (CP) -- Up to 400,000 Canadians might be driving Ford vehicles with faulty door latches that could lead to serious injury or death, according to a \$527-million class-action lawsuit commenced Tuesday against Ford Motor Co., Magna ...
business	Workers at Sri Lanka's main oil company end a two-day strike, held in protest at government plans to sell more of the company.
world	TBILISI (Reuters) - Overnight clashes killed six Georgian servicemen in the rebel South Ossetia region, which Tbilisi is trying to bring back under government control, Deputy Security Minister Gigi Ugulava said on Thursday.
business	Forbes.com - After earning a PH.D. in Sociology, Danny Bazil Riley started to work as the general manager at a commercial real estate firm at an annual base salary of #36;70,000. Soon after, a financial planner stopped by his desk to drop off brochures about insurance benefits available through his employer. But, at 32, "buying insurance was the furthest thing from my mind," says Riley.
world	MOSCOW -- Thousands of Russian children are adopted by foreigners every year -- but few go to such high-profile homes as the leader of Germany.
world	AP - An Israeli helicopter fired two missiles in Gaza City after nightfall Wednesday, one at a building in the Zeitoun neighborhood, witnesses said, setting a fire.
world	AP - With a bandanna on his head and a grin on his cheeks, Italy's flamboyant Premier Silvio Berlusconi has been playing vacation host to Britain's Tony Blair in Sardinia, an unlikely holiday coupling that highlights an Italian-British alliance bolstered by the Iraq war.
tech	Reuters - A group of consumer electronics\makers said on Wednesday they approved the format for a new\generation of discs that can store five times the data of DVDs\at the same cost -- enough to put a full season of "The\Sopranos" on one disc.
tech	SEATTLE (Reuters) - Microsoft Corp. &lt;MSFT.O&gt; released on Tuesday the latest version of its software for editing and organizing digital photographs and images to tap into widespread demand for digital cameras and photography.
world	Reuters - Suspected militants have kidnapped an\Iraqi intelligence officer in response to the fighting in the\holy city of Najaf, Al Jazeera television reported on Tuesday.
tech	AP - Warming water temperatures in the central equatorial Pacific last month may indicate the start of a new El Nino.
tech	\\I really hope SUN doesn't Open Source Java at JavaOne this year. It would be a\terrible decision and seriously hurt the tech industry. Also, it would hurt SUN\and I'm sure their responsible enough to realize this.\\(Lets hope that works!)\\
world	PORTLAND, Maine - Whether its blue or spotted or stripped, the standard issue hospital gown is drafty and revealing. It's embarrassing for just about anyone who's spent a night in a medical center...
business	British Airways workers plan to strike for 24 hours during the August Bank Holiday weekend unless a pay row is settled, the GMB union said.
tech	\\"I first heard about this from one of the developers of the hit game SimCity, who\told me that there was a critical bug in his application: it used memory right\after freeing it, a major no-no that happened to work OK on DOS but would not\work under Windows where memory that is freed is likely to be snatched up by\another running application right away. The testers on the Windows team were\going through various popular applications, testing them to make sure they\worked OK, but SimCity kept crashing. They reported this to the Windows\developers, who disassembled SimCity, stepped through it in a debugger, found\the bug, and added special code that checked if SimCity was running, and if it\did ...\\
world	An Israeli helicopter fires two missiles at targets in Gaza City, Palestinian witnesses say.
world	BAGHDAD : Shiite militia leader Moqtada Sadr has agreed to disarm and quit a holy shrine in Najaf as demanded by Iraq #39;s key national conference, one of the organisers of the meeting said.
tech	AP - A red-footed falcon spotted for the first time in North America is enticing birdwatchers to Martha's Vineyard.
world	An opposition movement refused to accept the results, raising prospects for more turmoil in the world's fifth-largest oil exporter.
business	Pepsi pushes a blue version of Mountain Dew only at Taco Bell. Is this a winning strategy?
sports	Southern California greeted news of its first preseason No. 1 ranking since 1979 with ambivalence.
