tech	AP - The number of days that beaches closed or posted warnings because of pollution rose sharply in 2003 due to more rainfall, increased monitoring and tougher standards, an environmental group said on Thursday.
world	Police defused a bomb near Italian Premier Silvio Berlusconi #39;s villa in Sardinia early today shortly after Tony and Cherie Blair ended a visit to the Italian leader.
world	KABUL (Reuters) - Thousands of U.S. troops in Afghanistan may have failed to catch Osama bin Laden but they are credited with encouraging millions of Afghans to register for the country's historic election in October.
business	Reuters - Kmart Holding Corp. (KMRT.O) on Monday\reported its third consecutive quarterly profit despite\slumping sales as it cut jobs and reduced advertising and\discounts, boosting its cash pile to #36;2.6 billion.
world	JERUSALEM (Reuters) - Israeli Prime Minister Ariel Sharon on Thursday won a final reprieve from criminal prosecution in a bribery scandal that had threatened to topple him and derail his plan to withdraw from the Gaza Strip.
world	The protesters coming to New York are receiving an outpouring of hospitality from scores of people who are opening their homes as temporary, free shelter.
business	WASHINGTON (Reuters) - U.S. consumer prices dropped in July for the first time in eight months as a sharp run up in gasoline costs reversed, the government said on Tuesday in a report suggesting the U.S. Federal Reserve can stick to a plan of gradual interest-rate rises.
world	Reuters - The United States will announce the sale\of four Aegis missile-defense warships to Taiwan next year with\delivery likely to begin in 2011, a newspaper said on Monday.
world	An Islamic cleric arrested in Pakistan for suspected al-Qaeda links dies in custody, officials say.
business	NEW YORK, Aug 17 (Reuters) - Mills Corp. (MLS.N: Quote, Profile, Research) , a real estate investment trust, on Tuesday said it agreed to buy a 50 percent managing stake in nine regional malls from General Motors Corp. #39;s (GM.N: Quote, Profile, Research) ...
world	Liechtenstein's Prince Hans-Adam hands over power to his son and invites the whole nation to a garden party.
world	Pakistan has announced bounties and published photographs of six wanted terrorist suspects, including a senior al-Qaida operative accused of masterminding two attempts to assassinate President Pervez Musharraf.
world	AP - Nine months of chaos and casualties in Iraq since Saddam Hussein's capture have taken a heavy toll on American opinion of President Bush's decision to go to war. Last December, when Saddam was caught, public support for Bush was 2-to-1 in favor. Now the public is evenly divided on whether the war was the right thing to do or whether it was a mistake.
tech	Liberal bias versus right-wing conspiracy is a wonderful distraction. There is evidence enough on both sides. How can opposite claims be true? Confront a physicist with evidence supporting contradictory hypotheses and she will go looking for a more basic cause. Let's try that.
world	AFP - Three Georgian soldiers have been killed and five wounded in clashes in Georgia's separatist region of South Ossetia, Rustavi 2 television reported, quoting an unnamed official with the Georgian interior ministry.
world	AFP - German Chancellor Gerhard Schroeder said that the hike in oil prices was not currently hurting the eurozone's biggest economy but that he was closely watching the cost of crude.
world	LONDON -- Eight men charged with conspiracy to murder in a trans-Atlantic terror plot made their first court appearance yesterday in a case that has added to the fierce debate over Britain's terrorism laws and heightened fears in the country's Islamic community of an anti-Muslim backlash.
world	North Korea was reluctant to accept a United States plan to give up its nuclear program but would probably attend the next round of talks on the impasse, Foreign Minister Alexander Downer said after a brief visit to Pyongyang.
world	Physicists have successfully teleported particles of light over a distance of 600m across the River Danube in Austria, the journal Nature reports.
business	WASHINGTON (Reuters) - US industrial output advanced in July, as American factories operated at their highest capacity in more than three years, a Federal Reserve report on Tuesday showed.
world	TOKYO (Reuters) - A Japanese chess great who plans to marry former world champion Bobby Fischer and help him avoid deportation home to the United States declared herself on Thursday to be a pawn seeking to become a queen.
world	AFP - A blockade of the Nepalese capital called by Maoist rebels entered a second day, causing a rise in food prices and prompting the government to declare the city had enough supplies for a month.
world	Chinese authorities detained a prominent, U.S.-based Buddhist leader in connection with his plans to reopen an ancient temple complex in the Chinese province of Inner Mongolia last week and have forced dozens of his American followers to leave the region, local officials said Wednesday.
tech	AP - Cave explorers discovered a pit inside a mountain range in central Croatia believed to have the world's deepest subterranean vertical drop, at nearly 1,700 feet, a scientific institute reported Monday.
world	The findings dealt a blow to supporters of the charter school movement, including the Bush administration.
tech	Globular star clusters are like spherical cathedrals of light -- collections of millions of stars lumped into a space only a few dozen light-years across. If the Earth resided within a globular cluster, our night sky would be alight with thousands of stars more brilliant than Sirius.
world	PRIME Minister John Howard said he would not be swayed by more public servants coming forward in relation to the children overboard scandal.
world	LONDON, Aug. 17 (Xinhuanet) -- British police on Tuesday charged eight terrorism suspects with conspiracy to murder.
world	LOS ANGELES - Elmer Bernstein, the versatile, Oscar-winning composer who scored such movie classics as "The Ten Commandments,""The Magnificent Seven,""To Kill a Mockingbird,""The Great Escape" and "True Grit," died Wednesday. He was 82...
business	TOKYO (Reuters) - Tokyo's Nikkei fell 1.66 percent by midday on Monday, extending losses into a third day as growing fears about the impact of surging oil prices on the global economy hit exporters such as Toyota Motor Corp.
business	NEW YORK (Reuters) - U.S. stocks were set to open higher on Tuesday after an economic report showed U.S. consumer prices dropped in July for the first time in eight months and another report said U.S. housing starts rebounded sharply in July.
world	AP - Omar Garcia Escobedo's family thought their 25-year-old son had, like so many other migrants seeking work in the United States, drowned trying to cross the treacherous, fast flowing Rio Grande River.
tech	AP - With more than 4,000 scientists, including 48 Nobel Prize winners, having signed a statement opposing the Bush administration's use of scientific advice, this election year is seeing a new development in the uneasy relationship between science and politics.
tech	In the new movie &lt;i&gt;Danny Deckchair,&lt;/i&gt; a truck driver ties party balloons to a chair and flies away. It's called cluster ballooning, and believe it or not, it's a real sport.
world	Reuters - Pakistan published pictures of six\"most-wanted terrorists" on Wednesday and offered rewards for\information leading to the arrest of two al Qaeda-linked\militants wanted over assassination attempts on the president.
world	Ian Thorpe and Michael Phelps will chase gold in the men's 200m freestyle on day three of the Olympics.
world	SASEBO, Japan -- On a cloudless afternoon in this sleepy port city, an 11-year-old girl drenched in blood and clutching a box cutter walked into the lunchroom at her elementary school. Teachers and students froze, assuming the sixth-grader known for her lighthearted nature had gravely hurt herself -- but she quickly dispelled that impression, witnesses said, by uttering a few ...
tech	In the next 100 years, Alaska will experience a massive loss of its historic tundra, as global warming allows these vast regions of cold, dry, lands to support forests and other vegetation that will dramatically alter native ecosystems. (Oregon State University press release)
world	LONDON - Eight men accused of plotting to commit murder and cause mayhem with radioactive materials, toxic gases, chemicals or explosives appeared in court Wednesday in a case linked to a U.S. terror alert this month...
world	AP - A top Republican congressman has broken from his party in the final days of his House career, saying he believes the U.S. military assault on Iraq was unjustified and the situation there has deteriorated into "a dangerous, costly mess."
world	AFP - The UN envoy to Sudan has tried to ease the pressure on Khartoum after a flurry of indictments of the government's failure to end the crisis in Darfur drew irate reactions from President Omar al-Beshir.
world	UNITED NATIONS (AP) A year after the bombing of UN headquarters in Baghdad killed 22 people, the United Nations remains a target for attacks in Iraq and UN staff angrily allege that major security ...
business	SINGAPORE (Reuters) - Oil prices fell \$1 below record highs on Tuesday as fears over supply disruptions in Venezuela eased after President Hugo Chavez won a vote on his rule.
tech	Locusts are commonly associated with plagues, food shortages, and death. But they are also inspiring what may be the next wave in lifesaving collision-avoidance systems.
world	An unidentified substance sent to the US embassy in the Malaysian capital Kuala Lumpur leads to a security scare.
world	Mud continues to be one of the biggest obstacles to relief efforts in Sudan #39;s Darfur region. Heavy rains have washed out roads and airstrips and the rainy season is expected to last another month or two.
world	AFP - Pakistan continues to support Islamic insurgency in Kashmir and will use militant attacks to influence ongoing peace talks with rival India, India's Home Ministry said in its annual report.
business	TJX Cos. Inc. #39;s second-quarter earnings fell 4 percent, reflecting higher markdowns on merchandise due to softer sales trends.
world	Prague, 17 August 2004 (RFE/RL) -- Fresh fighting and further casualties were reported overnight in Georgia #39;s separatist republic of South Ossetia. The violence erupted hours after Georgia and South Ossetia reached an agreement under which all armed units ...
world	NAJAF, Iraq (Reuters) - Radical Shi #39;ite cleric Moqtada al-Sadr has agreed to disarm his Iraqi militia and leave a holy shrine but only after a truce with encircling US marines.
world	CARACAS, Venezuela (Reuters) - Venezuelans crowded polling stations on Sunday to vote on whether to recall left-wing President Hugo Chavez or back his mandate to govern the world's No. 5 oil exporter for the next two years.
world	Reuters - Japan's Crown Princess Masako, who\officials say is suffering from a mental disorder caused by the\stress of adapting to royal life, may emerge from months of\seclusion in September to attend a wedding in the tiny\southeast Asian nation of Brunei, a court official said on\Tuesday.
world	BAGHDAD (Reuters) - Anti-US cleric Moqtada al-Sadr and his followers are ready to leave the Imam Ali shrine in Najaf if American-led forces pull back from the holy Shi #39;ite site, an aide to Sadr says.
business	NEW YORK, Aug 17 (Reuters) - Shares of Applied Materials Inc. (AMAT.O: Quote, Profile, Research) , the largest maker of chip-making tools, rose after the bell on Tuesday after the company said healthy spending on new semiconductor factories more than ...
world	KABUL (Reuters) - The United States has brokered a cease-fire between a renegade Afghan militia leader and the embattled governor of the western province of Herat, Washington's envoy to Kabul said Tuesday. "Our expectation is that the agreement that has been made will be honored," said ambassador Zalmay Khalilzad, adding that the cease-fire was due to take effect at 4 p.m.
world	ATHENS, Greece - Allen Iverson broke his right thumb but plans to play anyway Tuesday night for the U.S. Olympic basketball team, which is coming off an embarrassing loss to Puerto Rico in its opener...
world	ATHENS, Greece - His quest to surpass Mark Spitz out of the way, Michael Phelps got back to winning gold. The 19-year-old from Baltimore claimed his second gold medal of the Athens Games in the 200-meter butterfly Tuesday night, though he was a bit disappointed at failing to break his own world record...
world	BERLIN (Reuters) - German Chancellor Gerhard Schroeder and his wife, Doris, have adopted a 3-year-old Russian girl, German newspapers have reported.
business	Reuters - The dollar fell to a fresh four-week low\versus the euro on Monday after a widening of the U.S. trade\gap to record levels raised worries about capital inflows in\the United States and a possible slowdown in the economy.
sports	AP - Southern California will begin defense of its first national title in 31 years as the No. 1 team in the nation. The Trojans earned the top spot in the preseason Associated Press poll released Saturday by receiving 48 of 65 first-place votes and 1,603 points.
world	NEW DELHI -- A powerful bomb killed at least 16 people, many of them schoolchildren, and wounded about 40 others as they assembled for an Independence Day parade yesterday in the northeastern state of Assam, authorities said.
tech	Queue submissions being scarce, I suggest we all submit limericks for consideration. Mod up your favorites. I'm no poet, so I'll submit a favorite of my childhood: There was a young woman named Bright, Who traveled much faster than light She set out one day In a relative way And returned on the previous night. I'm afraid I don't remember the author.
tech	AP - About half the usual number of loggerhead turtles have nested between North Carolina and Florida this season, and scientists have no explanation for the drop.
world	ATHENS, Greece - Now this was a duel in the pool. With Michael Phelps leading off Tuesday night, the United States bested its rival from Down Under in the most thrilling race of the Athens Games...
world	CANBERRA : Australian opposition leader Mark Latham is in hospital with an inflamed pancreas, his office said.
world	AP - Venezuelan President Hugo Chavez won international approval from supporters and detractors alike Monday on his decisive referendum victory over opponents trying to oust him.
world	BOSCASTLE, England Rescue workers searched this coastal village in north Cornwall on Tuesday for missing persons after a flash flood sent a wall of water tearing through the picturesque tourist spot the day before.
world	AP - The Russian Supreme Court on Tuesday rejected an appeal from an arms control researcher who was sentenced to 15 years in prison for treason in what rights advocates have called a politically motivated case.
world	Human rights activists on Wednesday condemned the detention of a Hong Kong pro-democracy politician for allegedly having sex with a prostitute, and his sentencing without trial to six months of quot;re-education through labor. quot; ...
world	Yasser Arafat, the Palestinian leader, issued an unprecedented mea culpa yesterday, admitting that he had made mistakes and promising to rectify them.
business	Reuters - Oil exports by Venezuela\have not been disturbed by the referendum on the rule of\President Hugo Chavez, shipping sources said late Sunday.
world	AP - Two days after a grueling papal pilgrimage which left some wondering if Pope John Paul II could still travel, the Vatican on Tuesday announced details of the ailing pontiff's next trip.
world	WASHINGTON - Going against conventional wisdom, the Federal Reserve is raising interest rates in an election year. And it is Fed Chairman Alan Greenspan, a Republican, who is leading the charge even though an incumbent Republican in the White House is facing voter unrest about the state of the economy...
sports	AP - With Kobe Bryant's sexual assault trial scheduled to begin in less than two weeks, speculation is mounting that prosecutors are looking for a way to dismiss the charge after a series of setbacks.
business	JAKARTA (Reuters) - Non-OPEC oil exporters should consider increasing output to cool record crude prices, OPEC President Purnomo Yusgiantoro said on Sunday.
world	CARACAS, Venezuela - President Hugo Chavez survived a referendum to oust him, according to results Monday, and former U.S. President Jimmy Carter and other election observers urged the opposition to accept the vote, deflating claims of fraud...
world	A referendum is under way in Venezuela to decide if President Hugo Chavez should remain in office.
world	AFP - European Union nations criticised Sri Lanka's Tamil Tiger rebels for killing rivals and recruiting child soldiers, appealing to the guerrillas not to undermine the Island's Norwegian-led peace bid.
business	An interview with Google's co-founders due out in the current issue of Playboy may delay the company's IPO. Securities regulations restrict what executives can say while preparing to sell stock for the first time.
business	Halliburton Co. on Tuesday blamed politics for a US Army decision to not grant the company more time to resolve a billing dispute in which the Pentagon contends the company did not adequately account for some \$1.8 billion of work done in the Middle East.
world	India players agree central contracts for the first time, with top stars netting a basic salary of 59,000.
world	AFP - More than 50 people were airlifted to safety after landslides caused by violent rain trapped cars on a road in Scotland, just days after flash floods devastated a tourist village in southwest England.
tech	Reuters - Was absenteeism a little high\on Tuesday among the guys at the office? EA Sports would like\to think it was because "Madden NFL 2005" came out that day,\and some fans of the football simulation are rabid enough to\take a sick day to play it.
world	JAKARTA (Reuters) - Indonesian President Megawati Sukarnoputri, trying to maintain momentum in a tight election battle, said Monday her government had stabilized the economy and cracked down hard on militants and separatists.
world	Former US army sergeant Charles Robert Jenkins, who deserted to North Korea (news - web sites) four decades ago, said he decided to turn himself in to the US military and risk jail for the sake of his North Korean-born daughters, whom he feared might be
world	AP - Authorities are testing a suspicious powder mailed to the U.S. Embassy in Malaysia to determine whether it is anthrax, officials said Monday after the second such scare at a U.S. mission in Asia within a week.
business	When Inhibitex Inc. set the terms of its initial public offering in March, it thought it was being conservative, expecting shares to sell for \$10 to \$12 apiece.
world	Canadian Press - LONDON (AP) - More than 50 people were rescued by a naval helicopter Wednesday after two landslides caused by heavy rain trapped their vehicles on a highway in Scotland, police said.
business	NEW YORK (Reuters) - Rural hospital operator LifePoint Hospitals Inc. &lt;A HREF="http://www.investor.reuters.com/FullQuote.aspx?ticker=LPNT.O target=/stocks/quickinfo/fullquote"&gt;LPNT.O&lt;/A&gt; agreed to buy rival Province Healthcare Co. &lt;A HREF="http://www.investor.reuters.com/FullQuote.aspx?ticker=PRV.N target=/stocks/quickinfo/fullquote"&gt;PRV.N&lt;/A&gt; for \$1.03 billion in cash and stock to broaden its geographic reach, the companies said on Monday.
world	ATHENS, Ohio - A group of anarchists is taking an unusual step to make its political voice heard - going to the polls. Anarchists generally pride themselves on their rejection of government and its authority...
world	Heavy rains from Typhoon Megi pounded Shikoku island in western Japan, killing at least six people, the Mainichi Shimbus reported Wednesday.
world	ROME -- Police defused a bomb in a town near Prime Minister Silvio Berlusconi #39;s villa on the island of Sardinia on Wednesday shortly after British Prime Minister Tony Blair finished a visit there with the Italian leader.
world	The F.B.I. has been questioning demonstrators in an effort to forestall violent protests at the Republican National Convention.
business	WASHINGTON (CBS.MW) -- Construction of new homes recovered in July, as US homebuilders started homes at a seasonally adjusted annual rate of 1.978 million, the Commerce Department said Tuesday.
business	TORONTO (Reuters) - Electronic publisher Thomson Corp. &lt;TOC.TO&gt; said on Monday it will buy test provider Capstar from Educational Testing Service, the latest in a string of acquisitions designed to flesh out its product offerings.
world	Reuters - South Korean police used water cannon in\central Seoul Sunday to disperse at least 7,000 protesters\urging the government to reverse a controversial decision to\send more troops to Iraq.
world	Canadian Press - TORONTO (CP) - Field trials of genetically modified wheat are still being conducted in Canada by multinational biotech giant Monsanto despite a pledge earlier this year that the testing would be abandoned, critics said Tuesday.
world	ISLAMABAD (Reuters) - An Afghan Islamic cleric who died in custody in Pakistan on Wednesday had signs of torture on his body, an intelligence official said.
business	NEW YORK (Reuters) - Shares of top toy maker Mattel Inc. &lt;A HREF="http://www.investor.reuters.com/FullQuote.aspx?ticker=MAT.N target=/stocks/quickinfo/fullquote"&gt;MAT.N&lt;/A&gt; and rival Hasbro Inc. &lt;A HREF="http://www.investor.reuters.com/FullQuote.aspx?ticker=HAS.N target=/stocks/quickinfo/fullquote"&gt;HAS.N&lt;/A&gt; fell to their lowest levels at least 14 months on Monday after a downgrade by Lehman Brothers, which cited deteriorating industry conditions.
world	SADO. Japan -- A North Carolina man who deserted the US Army for North Korea nearly 40 years ago says today is the first day of the last chapter of his life.
world	AFP - Malaysian emergency services rushed to the tightly-guarded US embassy in Kuala Lumpur after a powder which police said could be anthrax was found in a letter.
world	THE threat to leading politicians from terrorist attack was underlined yesterday when extremists were able to plant a bomb close to the Sardinian villa where Tony and Cherie Blair were staying as guests of Silvio Berlusconi, the Italian prime minister.
world	Reuters - Israel's High Court said on Thursday\it was upholding a decision by the country's attorney-general\to drop a bribery case against Prime Minister Ariel Sharon.
world	Interior Ministry officials had earlier said the blast on Tuesday was caused by a car bomb. At least five cars were ...
business	Reuters - Private investment firm Carlyle Group,\which has a reputation for making well-timed and occasionally\controversial plays in the defense industry, has quietly placed\its bets on another part of the market.
business	WASHINGTON (Reuters) - U.S. industrial output advanced in July, as American factories operated at their highest capacity in more than three years, a Federal Reserve report on Tuesday showed.
world	Negotiations over the embattled city of Najaf took a new and complicated turn Thursday when an official of Iraq's interim government issued fresh demands to be met by rebellious Shiite cleric Moqtada Sadr, accompanied by warnings of an imminent military offensive at the shrine where Sadr's militia is holed up.
world	Security is stepped up in the border town of Bukavu after Rwanda and Burundi said they could send troops into Democratic Republic of Congo.
world	BAGHDAD (Reuters) - Iraqi delegates to a conference choosing a national assembly said Wednesday that radical Shi'ite cleric Moqtada al-Sadr had agreed to demands to end an uprising in the holy city of Najaf.
world	A relentless rise in the cost of employee health insurance has become a significant factor in the employment slump.
business	Russian oil giant Yukos is to ask a Moscow court for more time to pay its tax bill.
world	\Hong Kong's government warns people with heart and respiratory problems to stay in as smog chokes the territory.
world	Australia #39;s foreign minister, Alexander Downer, has wrapped up talks in North Korea on the stand-off over the country #39;s efforts to develop nuclear weapons.
tech	At Bungalow Billiards in Chantilly on Wednesday, about a dozen single parents from Northern Virginia gathered at happy hour to mingle, eat and drink. All were divorced or widowed members of the Fairfax chapter of Parents Without Partners.
world	BEIJING, Aug 18 (Reuters) - China said on Wednesday it hoped all six parties taking part in talks on the North Korea nuclear crisis keep calm, remain flexible and continue negotiations despite inevitable difficulties.
world	NEW YORK - U.S. stocks are seen in a cautious mood at the open Tuesday as investors weigh up the merits of Monday's oil-inspired rally...
world	BOSTON - Orlando Cabrera hit a run-scoring double off the Green Monster in the ninth inning on reliever Justin Speier's second pitch of the game, giving the Boston Red Sox a 5-4 win over the Toronto Blue Jays on Tuesday night. Pinch-hitter Dave Roberts drew a leadoff walk in the ninth and was forced out at second base on Johnny Damon's grounder off Kevin Frederick (0-2)...
sports	AP - Pitcher Mike Bacsik was designated for assignment by the Texas Rangers on Sunday after going 1-1 with a 4.60 ERA in three starts.
world	BUJUMBURA (Reuters) - The Burundi army said on Tuesday it might cross into neighboring Congo to pursue rebels and militia it blames for massacring 160 Congolese Tutsi refugees at a camp in western Burundi.
world	Legendary singer Shane MacGowan is to play a mini-residency at London's famous Ronnie Scott's jazz club.
