tech	New analysis of fossil bones indicates that adolescent &lt;i&gt;Tyrannosaurus rex&lt;/i&gt; dinosaurs grew extremely rapidly, quickly reaching gigantic size.
world	The vulnerability of world leaders to terrorist attack was starkly exposed again today by the discovery of a bomb near Tony Blair #39;s holiday villa on Sardinia.
world	AJAF, Iraq, Aug. 16 - Just five days after they arrived here to take over from Army units that had encircled Najaf since an earlier confrontation in the spring, new Marine commanders decided to smash guerrillas loyal to the rebel Shiite ...
business	CHICAGO (Reuters) - The main union at Caterpillar Inc. said its members voted on Sunday to reject the construction equipment maker's contract proposal, the second time this year the workers have voted against an offer.
world	Israeli Prime Minister Ariel Sharon has approved bids for construction of 1,000 homes in Jewish West Bank settlements after freezing them earlier this month, amid growing friction with the United States over continued settlement expansion.
world	Separatist militants kill four members of a Muslim family while police shoot dead a senior militant leader in Kashmir.
world	BEIJING (AP) China appealed to North Korea on Tuesday to join working meetings before a new round of six-party talks on dismantling its nuclear program, despite the North #39;s declaration that it saw no point in attending.
business	4Kids Entertainment got karate-chopped last week. Can it get back up off the mat?
tech	SPACE.com - While the exploration of the Moon and other planets in our solar system is nbsp;exciting, the first task for astronauts and robots alike is to actually nbsp;get to those destinations.
business	Amusement park operators have produced volatile results, but this company has stood the test of time.
tech	Company launched the biggest electronic auction of stock in Wall Street history Friday but warned that it could face legal liability from a Playboy magazine interview in which some aspects of the Internet search engine's performance were overstated. &lt;FONT face="verdana,MS Sans Serif,arial,helvetica" size="-2"\ color="#666666"&gt;&lt;B&gt;-The Washington Post&lt;/b&gt;&lt;/font&gt;
world	WASHINGTON - Over two decades, the income gap has steadily increased between the richest Americans, who own homes and stocks and got big tax breaks, and those at the middle and bottom of the pay scale, whose paychecks buy less. The growing disparity is even more pronounced in this recovering economy...
world	18 August 2004 -- There has been renewed fighting in the Iraqi city of Al-Najaf between US and Iraqi troops and Shi #39;a militiamen loyal to radical cleric Muqtada al-Sadr.
world	A parliamentary session due to have begun on Monday in the Maldives has been postponed indefinitely.
world	AFP - Italy's cultural cognoscenti were waiting with bated breath for the reopening of the La Scala opera house, restored to its former glory after a sumptuous 61 million euro (81 million dollar) makeover.
world	AP - Elizabeth Burnosky is a registered Democrat who voted for President Bush in 2000, opposes his policy on Iraq and calls Sen. John Kerry "a little wussy boy." Call her conflicted.
world	NAJAF, Iraq (Reuters) - The leader of a Shi #39;ite uprising in Iraq agreed Wednesday to leave a holy shrine encircled by US marines, hours after the interim government threatened to storm it and drive out his fighters.
world	AP - Police defused a time-bomb in a town near Prime Minister Silvio Berlusconi's villa on the island of Sardinia on Wednesday shortly after British Prime Minister Tony Blair finished a visit there with the Italian leader.
business	No other recording artist can channel American middle-class tastes quite like Chip Davis and his best-selling band
business	One of our new categories in the APMF Sense of Place survey is for best Asian business city. After a couple of days, Singapore leads the pack, followed by Bangkok, Thailand and Hong Kong. Enter your vote and comments and make your views count. More new categories include best city for livability, and best tourism destinations.
sports	There were few offensive highlights during Virginia Tech's first scrimmage of fall practice on Saturday.
business	TORONTO - Shares of Nortel Networks dipped on the TSX in the wake of news the RCMP has launched an investigation into accounting practices at the telecommunications company.
world	AP - Americans who served in the military will be well represented at the upcoming Republican convention, more so than at last month's Democratic convention or in the U.S. population overall, according to the GOP.
world	Reuters - If U.S. and Iraqi troops launch a\major assault on radical cleric Moqtada al-Sadr's militants,\they will have to pass through sniper-infested streets to root\them out of a mosque they can't afford to harm.
world	In a bid to keep protesters from disrupting the Republican National Convention, the Bloomberg administration is offering "peaceful political activists" discounts.
tech	AP - The #36;10 million competition to send a private manned rocket into space started looking more like a race Thursday, when a Canadian team announced plans to launch its rocket three days after an American group intends to begin qualifying for the Ansari X prize.
world	AP - An official once in charge of guarding cultural relics has been sentenced to death in China's biggest antiquities theft case since the start of communist rule in 1949.
world	GAZA (Reuters) - An explosion tore through the home of a senior Hamas militant in Gaza on Wednesday, killing at least four people and wounding him and about a dozen other Palestinians, medics said.
world	TEHRAN (Reuters) - Kidnappers holding an Iranian diplomat in Iraq will "punish" him within 48 hours if Iran does not release 500 prisoners captured in its 1980-1988 war with Iraq, Iranian state television said Sunday.
world	TOKYO (Reuters) - In a bold gambit worthy of the chess champion he once was, Bobby Fischer plans to wed a four-time Japan great in the hope of avoiding deportation home to the United States, where he is wanted for breaking sanctions.
world	CARACAS, Venezuela - Summoned by bugle calls and the detonations of huge firecrackers, Venezuelans turned out in unprecedented numbers Sunday to vote on whether to force leftist President Hugo Chavez from office. Some lines at polling places extended for 1.25 miles, stunning even veteran election monitors...
business	CHICAGO (Reuters) - Deere Co. &lt;A HREF="http://www.investor.reuters.com/FullQuote.aspx?ticker=DE.N target=/stocks/quickinfo/fullquote"&gt;DE.N&lt;/A&gt;, one of the world's largest farm equipment makers, said on Tuesday that quarterly earnings jumped 62 percent, driven by strength in its agricultural and construction equipment businesses.
world	AFP - Princess Anne was in Cyprus to pay a royal morale-boosting visit to Britain's Olympic athletes training on the Mediterranean island before heading off to the Athens Games.
world	RAMALLAH, West Bank (Reuters) - Palestinian President Yasser Arafat made a rare admission of mistakes on Wednesday and urged reforms to end corruption after an unprecedented wave of turmoil.
business	CHICAGO (Reuters) - Illinois residents will soon be able to buy lower-cost prescription drugs from Canada, the United Kingdom and Ireland, sidestepping U.S. regulators' objections to imported drugs, Gov. Rod Blagojevich said on Tuesday.
business	If Hurricane Charley blows your house down, how can you make your insurance company pay?
world	NAJAF, Iraq -- Radical Shi #39;ite Muslim cleric Moqtada al-Sadr refused yesterday to meet with a delegation of Iraqi political figures that had rushed here from Baghdad with a last-ditch offer for peace, ...
tech	SPACE.com - When Venus crossed the Sun June 8, showing up as a clear black dot to the delight of millions of skywatchers around the world, astronomers noted something less obvious: The amount of sunlight reaching Earth dipped by 0.1 percent for a few hours.
business	Hewlett-Packard shares fall after disappointing third-quarter profits, while the firm warns the final quarter will also fall short of expectations.
world	AFP - Global mining giant BHP Billiton posted the biggest net profit in Australian corporate history as soaring commodities prices and strong demand from China pushed net profit up 83 percent to 3.51 billion US dollars.
world	Reuters - Rwandan troops were airlifted on Sunday\to Sudan's Darfur as the first foreign force there, mandated to\protect observers monitoring a cease-fire between the Sudanese\government and rebels in the troubled western region.
world	JERUSALEM (Reuters) - Israel declared psychological war on hunger-striking Palestinian prisoners on Monday, saying it would barbecue meat outside their cells to try to break their will.
sports	HAVEN, Wis. -- Perched high on the bluffs overlooking Lake Michigan, Whistling Straits is a massive, windswept landscape, as large a golf course as \$40 million can buy. It is complete with sand dunes that could double as ski slopes and deep bunkers that should require elevators.
world	AFP - German carrier Lufthansa said it would levy a temporary fuel surcharge on tickets from August 24, in response to the rise in the price of oil.
business	NEW YORK/SAN FRANCISCO (Reuters) - Google Inc. appeared set to start trading on Nasdaq on Wednesday, after the Web's No. 1 search engine asked regulators on Monday for final approval to price its closely watched initial public offering.
world	Jailed Fatah leader Marwan Barghouti may be close to withdrawing from the race for Palestinian Authority president. Hatem Abdel Kader, a member of Fatah #39;s
business	Saudi Arabia says it is ready to push an extra 1.3 million barrels a day of oil into the market, to help reverse surging prices.
tech	The UK's ad watchdog rules over which net connections can be described as full speed broadband.
world	JERUSALEM - The Israeli government issued bids Tuesday for 1,000 new homes in Jewish West Bank settlements, insisting the construction has Washington's tacit approval even though it violates a U.S.-backed peace plan. U.S...
tech	If it's possible to love something just because it could visit torrents upon the Washington region, fling hail from the skies and swell streams into rivers, then Jason Samenow is smitten.
world	AP - Stung by criticism about its role in fighting terrorism, Saudi Arabia has launched a radio advertising campaign in 19 U.S. cities citing the Sept. 11 commission report as proof that it has been a loyal ally in the fight against al-Qaida.
world	After falling on the landing of his vault, Paul Hamm put on two of the most spectacular routines of his career to win Olympic gold, the first ever by a U.S. man.
tech	\\I've been a big fan of Log4J for a while now but haven't migrated any code\over for one central reason. The following line of code:\\ final static Logger logger = Logger.getLogger( "some.name" );\\... is amazingly ugly and difficult to work with.\\Most people use Log4J with a logger based on the classname:\\So we would probably see:\\ static Logger logger = Logger.getLogger( "org.apache.commons.feedparser.locate.FeedLocator" );\\Which is amazingly verbose. A lot of developers shorten this to:\\ static Logger logger = Logger.getLogger( FeedLocator.class );\\But this still leaves us with cut and paste errors.\\What if we could just reduce it to:\\ static Logger logger = Logger.g ...\\
tech	Microsoft is stopping people getting hold of a key security update via net-based file- sharing systems.
world	SAN SALVADOR (Reuters) - Rival groups of inmates battled with guns, grenades and machetes at a prison in El Salvador on Wednesday, killing at least 31 prisoners.
sports	AP - Spain's Rafael Nadal won his first ATP singles title Sunday, beating Argentina's Jose Acasuso 6-3, 6-4 in the final at the Idea Prokom Open.
business	Toyota has been outbid by a land developer for state-owned property in York Township, but officials say this is one deal that will be decided by more than money.
world	AFP - India is projected to outpace China and become the world's most populous country by 2050, growing by 50 percent in the next 46 years to reach more than 1.6 billion people, a US research institute said.
world	LOS ANGELES - The state attorney general's office has concluded that Michael Jackson was not "manhandled" by sheriff's deputies who took him into custody last year on child molestation charges, CBS News reported Sunday. The findings were contained in a three-page letter Martin A...
world	Finland has kept its place at the top of a survey measuring teenagers #39; educational skills, with schools in some Asian countries also among the best performers.
world	CARACAS, Venezuela - President Hugo Chavez appeared to have survived a popular referendum to oust him, according to early results Monday, while Venezuela's opposition swiftly claimed fraud. Backers of the leftist populist president set off fireworks and began celebrating in the streets of the capital in the pre-dawn darkness upon hearing the news from Francisco Carrasquero, president of the National Elections Council...
business	OTTAWA (Reuters) - Nortel Networks Corp. investors predicted Tuesday the telecom equipment giant will again slash jobs when it reports long-overdue results this week, and shrugged off news of another criminal probe into its high-profile accounting woes.
world	GENEVAUN Secretary-General Kofi Annan yesterday met survivors and families of the 22 workers killed in a suicide bombing that shattered United Nations offices in Baghdad last year an attack many employees refer to as quot;our Sept. 11. quot; ...
world	AFP - Nigeria's President Olusegun Obasanjo called for lawmakers to approve the deployment of up to 1,500 peacekeeping troops to Sudan's war-torn province of Darfur, as Khartoum pledged to restore order there.
world	Researchers have identified more genetic mutations that appear to be linked with cot death.
business	NEW YORK (Reuters) - Media company Belo Corp. &lt;A HREF="http://www.investor.reuters.com/FullQuote.aspx?ticker=BLC.N target=/stocks/quickinfo/fullquote"&gt;BLC.N&lt;/A&gt; on Monday said it would refund \$23 million to advertisers because of a circulation scandal at its Dallas Morning News newspaper, resulting in a charge against earnings in the current quarter.
business	The Office of Fair Trading has set the clock ticking on the process that could see the Barclay brothers #39; deal to buy the Daily Telegraph reviewed by competition watchdogs.
world	Canadian Press - REAL, Philippines (AP) - Relief crews battling walls of mud and lashing rain to reach villages still isolated days after back-to-back storms devastated the northeastern Philippines have found 51 more bodies, taking the death toll to at least 740 people, officials said Tuesday.
world	TOKYO, Japan -- The Japanese woman who plans to marry former world chess champion Bobby Fischer says their feelings are genuine.
business	WASHINGTON (Reuters) - Housing starts rebounded sharply in July, making up almost all the ground lost in a June slump by posting their largest monthly percentage gain since September 2002, a report from the Commerce Department on Tuesday showed.
business	Reuters - Outback Steakhouse Inc. (OSI.N) on\Tuesday said it lost about 130 operating days and up to #36;2\million in revenue because it had to close some restaurants in\the South due to Hurricane Charley.
business	SAN FRANCISCO (Reuters) - Applied Materials Inc. &lt;A HREF="http://www.investor.reuters.com/FullQuote.aspx?ticker=AMAT.O target=/stocks/quickinfo/fullquote"&gt;AMAT.O&lt;/A&gt;, the largest maker of chip-making tools, on Tuesday said healthy spending on new semiconductor factories more than doubled revenue and returned it to a quarterly profit.
world	French rock star Bertrand Cantat could return home from Lithuania to complete his jail term for killing his lover.
world	ISLAMABAD, Pakistan : Aug 18 (PID) - President General Pervez Musharraf Tuesday urged the Parliamentarians not to compromise governance for personal gains and work selflessly to serve the people and earn a rightful place for the country in the comity of ...
tech	\\For some reason I never released this code.\\I developed it while working on NewsMonster and just forgot I think\\It's an extension for Mozilla that allows you to see all runtime exceptions\(with full stack traces) that are unhandled by Mozilla. \\Just install it and if your code generates an unhandled exception it will show\up in the logs and on the console.\\Very handy for doing any hardcore Mozilla development.\\
tech	Reuters - As Shakespeare said, a rose by any other\name would smell as sweet. Right?
world	AFP - The older the violin, the sweeter the music. And the Athens Olympics is proving the lyrics right as Martina Navratilova, Merlene Ottey and company are demonstrating the endurance of women with middle-aged ladies defying perceptions about age and competition in nearly every sport.
business	NEW YORK (Reuters) - Some mutual funds invest in stocks; others invest in bonds. Now a new breed of funds is offering the chance to own fine art.
business	A Marlborough-based technology company is suing five former employees, including three senior managers, for allegedly conspiring against their employer while working on opening a competing business.
world	BRUSSELS One of 15 cardinals with Pope John Paul II during a weekend visit to a French shrine was quoted in Belgian news media on Monday as saying the ailing pontiff may have been making his farewells.
world	ATHENS, Greece - Michael Phelps took care of qualifying for the Olympic 200-meter freestyle semifinals Sunday, and then found out he had been added to the American team for the evening's 400 freestyle relay final. Phelps' rivals Ian Thorpe and Pieter van den Hoogenband and teammate Klete Keller were faster than the teenager in the 200 free preliminaries...
world	Pakistan on Wednesday offered huge rewards totalling Rs 6.5 crore for information leading to the capture of six most wanted terrorists linked to al-Qaeda, including a member of the banned Jash-e-Mohammad who is accused of masterminding two suicide attacks ...
world	ISLAMABAD (Reuters) - Pakistan's military Monday played down a report in the latest edition of Time magazine describing what it called a "summit of terrorists" held in March in lawless tribal areas bordering Afghanistan.
world	KAMPALA, Uganda (Reuters) - Ugandan troops killed nine Lord's Resistance Army (LRA) rebels after a devastating raid on the group's headquarters in southern Sudan scattered its main force, the army said Tuesday.
business	Microsoft is stopping people getting hold of a key security update via net-based file- sharing systems.
world	AP - Hezbollah's executive has re-elected Sheik Hassan Nasrallah as leader of the militant Shiite Muslim movement, according to a statement Monday by the party that the United States brands as terrorist.
tech	The MODIS instrument aboard NASA's Terra satellite captured this true-color image of Typhoon Rananim on August 12 at 2:40 UTC.
world	A former American soldier accused of kidnapping and torturing terror suspects in Afghanistan has told a Kabul court that the FBI is withholding hundreds of documents showing that he was working for the US Government.
world	\Six Chinese protesters have threatened to jump from the top of a six-storey building in central Beijing.
world	AFP - Eight men arrested in an anti-terror swoop in London and other parts of England two weeks ago were charged with conspiracy to murder and other terrorist-related activities.
tech	Armed poachers from Sudan have been raiding and destroying neighboring Central African Republic's wildlife resources for years. Now, with the help of a militant U.S. conservationist, the CAR populace is arming and training itself to fight back.
tech	Investors in the company that's trying to come off as cute as a bunny could find themselves holding a fistful of vipers if the founders of Google Inc. continue to do things like show up in Playboy magazine around the same time their company is going public. &lt;FONT face="verdana,MS Sans Serif,arial,helvetica" size="-2"\ color="#666666"&gt;&lt;B&gt;-washingtonpost.com&lt;/B&gt;&lt;/FONT&gt;
business	Fellow Fool Alyce Lomax and I need to debate Pier 1 Imports (NYSE: PIR). Between Alyce covering the company warnings and me advising not to jump off the pier, there has been little good news to report. Is Pier 1 ready to get ...
business	NEW YORK (Reuters) - Staples Inc. &lt;A HREF="http://www.investor.reuters.com/FullQuote.aspx?ticker=SPLS.O target=/stocks/quickinfo/fullquote"&gt;SPLS.O&lt;/A&gt;, the top U.S. office products retailer, on Tuesday reported a 39 percent jump in quarterly profit, raised its full-year forecast and said it plans to enter the fast-growing Chinese market.
world	Saudi visitors to Malaysia were up 53 percent in 2004.
world	The secretary general of the United Nations fights a war on many fronts in his crusade to bring human rights and peace to the world.
world	Colombia offers to exchange jailed rebels for hostages held by Farc militants - a reversal of earlier policy.
world	British police have charged eight terrorist suspects with conspiring to commit murder and use radioactive materials, toxic gases, chemicals or explosives to cause quot;fear or injury quot; in a case involving an alleged top al-Qaeda operative at the centre of a US ...
business	Even a genius can mess up. Bill Gates was a brilliant technologist when he cofounded Microsoft , but as he guided it to greatness in both size and historical consequence, he blundered. He terrorized underlings with his temper and parceled out praise like Scrooge gave to charity. Only the lash inspired the necessary aggressiveness to beat the competition, he thought.
world	Hamas militants broke three weeks of relative calm in Gaza on Tuesday, setting off a bomb in what they said was an elaborate scheme that included a tunnel and a double agent.
world	A Syrian court has released on bail a human rights activist charged with tarnishing the country's image but considered by advocacy groups to be a prisoner of conscience, one of his attorneys said Monday.
world	Reuters - U.S. forces killed more than 50 Shi'ite\militiamen Wednesday in a significant advance into a Baghdad\suburb that is a powerbase for radical cleric Moqtada al-Sadr,\the military said.
world	The radical Shia cleric Moqtada al-Sadr was reported last night to have accepted a peace deal that could end the violent two-week uprising in Najaf and see his militia leave the city #39;s Imam Ali Shrine.
world	At least 18 students have been killed in clashes between rival student gangs in south-eastern Nigeria.
business	NEW YORK (Reuters) - U.S. stocks gained on Monday as oil prices dipped after reports of victory for the Venezuelan president in a referendum on his rule eased fears about the country's oil exports.
world	Television footage aired over the weekend showed a group of Rwandan soldiers dancing and clapping their hands. With AK-47 assault rifles firmly strapped across their shoulders, the 150 troops sported green berets adorned with African Union badges as they ...
world	BAGHDAD, Iraq - Delegates at Iraq's National Conference called Monday for radical Shiite cleric Muqtada al-Sadr to abandon his uprising against U.S. and Iraqi troops and pull his fighters out of a holy shrine in Najaf...
world	Ian Thorpe sets the fastest time in the 200m freestyle as swimming's top names cruise into the semi-finals.
business	Halliburton (HAL:NYSE - news - research) sank Tuesday after the Army chose not to extend a deadline for the company to explain its billing in Iraq.
business	The billing dispute between the US Army and Houston-based Halliburton Co. continues as the Army on Tuesday said it would withhold paying 15 percent of future invoices from Halliburton.
business	Reuters - The bulls and the bears are in this\together, scratching their heads and wondering what's going to\happen next.
business	Sysco's fiscal fourth-quarter profit rose 16 percent due to an extra week in the quarter, customer-service initiatives and operating efficiency.
sports	AP - Italy's Flavia Pennetta won the Idea Prokom Open for her first WTA Tour title, beating Klara Koukalova of the Czech Republic 7-5, 3-6, 6-3 Saturday after French Open champion Anastasia Myskina withdrew before the semifinals because of a rib injury.
business	Reuters - Oil prices jumped to a new record\high near #36;47 on Monday with traders on tenterhooks for the\result of Venezuela's weekend referendum and Iraq's exports\again disrupted by a Shi'ite uprising in the south.
business	Google has signaled that its share auction is nearly complete, asking the Securities and Exchange Commission for approval to begin selling 25.7 million shares of stock starting late this afternoon.
world	Iran's Arash Miresmaili withdraws from the Olympics amid confusion over his reasons.
business	Reuters - Exporters led a fall in Asian shares\on Monday as oil prices set new highs near #36;47 and data showing\the U.S. trade deficit widened to a record raised fresh concern\about the health of the world's largest economy.
world	Reuters - Cities in Okinawa expressed outrage at\the U.S. military on Tuesday for refusing to allow Japanese\police investigate the wreckage of a Marine helicopter that\crashed in the grounds of a university there last week.
world	A British soldier has been killed and another injured after clashes with militia forces in the southern Iraqi city of Basra, said the British Army.
business	NEW YORK, August 17 (New Ratings) Analysts at Merrill Lynch say that a recent survey of global fund managers demonstrates continuously increasing negative sentiments towards the US stock market trends.
sports	A fourth-quarter lead proves fleeting for the Redskins as John Kasay hits a 52-yard field goal Saturday to give the Panthers a 23-20 overtime win.
