world	Aug. 19 (Bloomberg) -- Typhoon Megi churned through the Tsushima Straight dividing Japan and South Korea, leaving nine people dead and thousands homeless as it damaged crops, dumped heavy rains and grounded flights.
world	Aug. 17 (Bloomberg) -- The Vatican is willing #39; #39; to help end fighting between militiamen loyal to Shiite Muslim cleric Moqtada al-Sadr and Iraqi and US forces in Iraq #39;s holy city of Najaf, according to a statement on the Holy See #39;s Web ...
world	AFP - President Megawati Sukarnoputri forged a pact with Indonesia's largest political group Golkar to form a bloc that will dominate parliament but is seen as unlikely to ensure her reelection.
tech	People in the UK are spending more time and money going digital, says communications watchdog Ofcom.
world	A British soldier was believed to have been killed and another seriously injured last night after clashes with Shia fighters in the southern Iraqi city of Basra.
world	Chicago Tribune - Pop stars are no strangers to bad behavior. Smashed guitars, ruined hotel rooms--such misdeeds often are chuckled over later, written up in the tabloids, perhaps listed on invoices for damage. Not so in Russia, where the public expects its performers to remember that they walk in Tchaikovsky's footsteps.
world	BEIJING - China said yesterday that its close ally North Korea will not be pulling out of six-party talks, despite Pyongyang hinting that Washington #39;s hardline policy made the negotiations unworkable.
world	Reuters - Thousands of Palestinian\prisoners in Israeli jails began a hunger strike for better\conditions Sunday, but Israel's security minister said he\didn't care if they starved to death.
tech	\\Java developers often load system properties to customize the runtime behavior\of their applications.\\For example a develoepr could define a 'max_connections' system property to\define the maximum number of TCP connections that their application server can\support. While nice, this prevents all other applications from using this\variable name.\\The first reaction to this would be to namespace your variable names. Instead\of using max_connections you would now use\'my.application.Server.MAX_CONNECTIONS' as your property name. This works of\course but now you have to load this property on startup.\\public static int MAX_CONNECTIONS = Integer.parseInt( System.getProperty(\"my.application.Se ...\\
world	SANTA MARIA, Calif. - Fans of Michael Jackson erupted in cheers Monday as the pop star emerged from a double-decker tour bus and went into court for a showdown with the prosecutor who has pursued him for years on child molestation charges...
business	The US trade deficit has exploded 19 to a record \$55.8bn as oil costs drove imports higher, according to a latest figures.
world	Michael Jackson's lawyers fail in their attempt to have evidence seized in a raid on his ranch thrown out.
world	The second hearing in the trial of three Americans accused of torture and running a jail begins in Kabul.
business	President Bush has been saying that the US economy has ''turned the corner. quot; Democratic presidential candidate Senator John F. Kerry, in the wake of this month's poor jobs report, quipped that it was more like a U-turn.
world	AFP - The Sudanese army expressed opposition to the upgrading of an African Union protection mission newly arrived in the wartorn western region of Darfur into a full-blown peacekeeping force.
business	NEW YORK (Reuters) - Short-sellers, Wall Street's dwindling band of ultra-cynics, are seeing green again.
world	ROME (Reuters) - A bomb has been defused overnight near the Sardinian holiday villa of Prime Minister Silvio Berlusconi hours after a visit by Tony Blair, Italian police say.
business	Chinese net stock Sohu.com (Nasdaq: SOHU) dropped by 10 on Friday after the company announced that its multimedia messaging services with China Mobile Communication had been temporarily suspended for a year. The sanctions were ...
world	A fresh trial of Hindus accused of burning to death Muslims during the 2002 Gujarat riots is due to begin in Bombay.
tech	AP - Residents burned tires and trash in the streets Thursday trying to drive off swarms of locusts descending on the region in what a U.N. agency called the worst sub-Saharan invasion in more than a decade.
sports	NEW YORK (Reuters) - Chipper Jones cracked two homers and Julio Franco's two-run double in the seventh inning drove in the winning runs as the streaking Atlanta Braves downed the St. Louis Cardinals 9-7 in the National League Saturday.
world	Indian asks Bangladesh to spare the lives of around 100 elephants which have strayed across the border.
world	President Bush #39;s plan to begin pulling most of the US troops out of Europe nearly fifteen years after the fall of the Berlin Wall has many Germans worried.
tech	\\I'm starting to realize that my blog is a bit of a time machine. For example I\can create a blog entry to warn myself about something that WILL happen in the\future. \\My current NTP blog entry is a good example. I wrote this for myself as\much as for the people who read my blog (or find me via Google).\\I know for sure that NTP on Debian is going to bite me sometime in the future\and I'm going to forget WHY. Then I'm going to (of course) go to Google or my\aggregator and search for NTP and then find my blog post. \\I've done this about a dozen times now and its saved me a TON of time!\\
business	Correction: Because of a reporting error, an article in yesterday's Nation pages incorrectly described a Bush campaign ad's accusation about John Kerry's role on the Senate Intelligence Committee in the 1990s. The ad accuses Kerry of having missed three-quarters of the committee's public hearings.
business	NEW YORK (Reuters) - The dollar posted gains against the euro on Tuesday, digesting a slew of U.S. economic data that failed to substantially alter expectations for Federal Reserve interest rate hikes.
world	CINCINNATI - John Kerry, telling fellow combat veterans he's their "true brother in arms," said Wednesday that President Bush's plan to withdraw U.S. troops from Europe and Asia would weaken U.S...
world	Greek sprinters Kostas Kenteris and Katerina Thanou are given random drugs tests.
world	AFP - Sporadic gunfire and shelling took place overnight in the disputed Georgian region of South Ossetia in violation of a fragile ceasefire, wounding seven Georgian servicemen.
business	Economic growth in Japan slows down as the country experiences a drop in domestic and corporate spending.
world	Reuters - Web surfers from Beijing to Berkeley\have made Google their search engine of choice, but some of\Europe's institutional investors have gone sour on the dot-com\on the eve of its initial public offering.
world	If there are any democratic quot;T #39;s quot; to be crossed and quot;I #39;s quot; to be dotted, Palestinian President Yasser Arafat did not leave one undone during his keynote speech to MPs at his West Bank headquarters in Ramallah. Arafat looked rejuvenated and emphatic as he ...
world	MIAMI - Hurricane Charley probably will not cause Floridians' insurance premiums to skyrocket like 1992's Andrew, and fewer insurers should go bankrupt from paying out damages expected to reach the billions of dollars, state and industry officials said Saturday. They say previous premium increases and overhauls made because of Andrew, the most expensive natural disaster in U.S...
tech	AP - The prospect that a tropical storm and a hurricane #151; or possibly two hurricanes #151; could strike Florida on the same day is something meteorologists say they have never seen.
world	Kostas Kenteris and Katerina Thanou's coach believes they will be cleared by the IOC.
sports	The Yankees' Alex Rodriguez , who missed Friday night's game with the flu and stayed back at the team hotel yesterday, dropped his appeal of a four-game suspension issued for his involvement in the July 24 brawl at Boston and began serving the penalty. He won't be eligible to play until Thursday at Minnesota.
world	NAJAF, Iraq (Reuters) - An Iraqi peace delegation has urged a radical Shi #39;ite cleric to call off his uprising in the city of Najaf, where US troops have been pounding militia positions near the country #39;s holiest Islamic sites.
sports	At 5 feet 8, 160 pounds, second baseman Mike Fontenot looks more like the Class AAA Ottawa Lynx's batboy than one of the Baltimore Orioles' top prospects.
world	AP - The new U.N. administrator for Kosovo took control Sunday of the Serbian province, which has remained deeply divided along ethnic lines since the end of a 1999 war.
world	Hurricane Charley - one of the most powerful storms in the nation's history - caused at least \$20 billion in damage in Florida alone.
tech	by Harry Bortman In this second and final part of the interview, Lunine explains how Huygens may help scientists understand the origin of life on Earth, even if it doesn't detect life on Titan. Astrobiology Magazine -- Titan is the only moon in our solar system with an atmosphere, and it is the organic chemistry that has been detected in that atmosphere that has sparked the imagination of planetary scientists like Lunine...
world	SEOUL (Reuters) - The chairman of South Korea #39;s ruling Uri Party resigned on Thursday after saying his father had served as a military police officer during Japan #39;s 1910-1945 colonial rule on the peninsula.
world	AP - A Belgian teenager fired off a mobile phone text message to her father that his live-in girlfriend was trying to kill her in a plea for help just before she died, authorities said.
world	MILWAUKEE - Jay Haas became the second-oldest player to be on the Ryder Cup team, joining Stewart Cink as the two captain's picks Monday for a U.S. team that will try to regain the cup from Europe next month...
world	RAMALLAH, West Bank (Reuters) - Palestinian President Yasser Arafat, under pressure to enact anti-corruption reforms, said on Wednesday that some officials had misused their posts and urged efforts to correct "all the mistakes."
world	JERUSALEM (Reuters) - Israel declared psychological war on hunger-striking Palestinian prisoners Monday, saying it would barbecue meat outside their cells to try to break their will.
world	Reuters - Raids by Sudanese forces and Arab\militiamen have worsened a desperate situation in Darfur,\rights groups say, but the United Nations said Khartoum was\making serious efforts to keep pledges to curb the violence.
sports	Avoiding the late trouble that knocked other contenders off track, Vijay Singh held a one-stroke lead over Justin Leonard heading into the final round of the P.G.A. Championship.
business	NEW YORK (Reuters) - Outback Steakhouse Inc. &lt;A HREF="http://www.investor.reuters.com/FullQuote.aspx?ticker=OSI.N target=/stocks/quickinfo/fullquote"&gt;OSI.N&lt;/A&gt; on Tuesday said it lost about 130 operating days and up to \$2 million in revenue because it had to close some restaurants in the South due to Hurricane Charley.
world	Reuters - A radical Iraqi cleric leading a\Shi'ite uprising agreed on Wednesday to disarm his militia and\leave one of the country's holiest Islamic shrines after\warnings of an onslaught by government forces.
tech	AP - Meteorologists at North Carolina State University are working on a way to more accurately measure rainfall in small areas.
business	AP - Discount retailer Kmart Holding Corp. reported Monday that the company swung to a profit in the second quarter, but same-store sales were still in decline.
business	NEW YORK (Reuters) - US stocks ended higher on Tuesday, even as oil prices hit another record, as investors were encouraged by data showing an easing of inflationary pressure and a sharp rebound in the housing market.
world	LOURDES, France (Reuters) - Pope John Paul, a sick man among the sick, wound up a emotional visit to this miracle shrine Sunday and struggled with iron determination to finish a sermon in order to encourage others suffering around him.
world	NEW YORK - Buyers put a positive spin on the equity markets Wednesday, shrugging off rising crude futures as Google Inc. prepared to sell its stock in an initial public offering, albeit it at a far lower price than previously forecast...
business	NEW YORK (Reuters) - The dollar tumbled broadly on Friday after data showing a record U.S. trade deficit in June cast fresh doubts on the economy's recovery and its ability to draw foreign capital to fund the growing gap.
business	LONDON -- The U.K.'s National Health Service (NHS) has tapped IT researcher Gartner Inc. to provide market intelligence services as the health organization forges ahead with a mammoth, 5 billion (\$9.2 billion) project to upgrade its information technology infrastructure.
business	NEW YORK (Reuters) - Time is running out for prospective investors to submit their offers to buy shares of Google Inc, the Web's No. 1 search company.
world	ATHENS, Greece - Top American sprinters Jason Lezak and Ian Crocker missed the cut in the Olympic 100-meter freestyle preliminaries Tuesday, a stunning blow for a country that had always done well in the event. Pieter van den Hoogenband of the Netherlands and Australian Ian Thorpe advanced to the evening semifinal a day after dueling teenager Michael Phelps in the 200 freestyle, won by Thorpe...
world	Russian leader Vladimir Putin voices doubts over plans to hold elections in Iraq next month.
world	Italian police today said they had defused a bomb near the Italian prime minister Silvio Berlusconi #39;s Sardinian holiday villa, only hours after a visit by the prime minister, Tony Blair.
world	PUNTA GORDA, Fla. - As Florida residents began sweeping up the wreckage left behind by Hurricane Charley, officials on Sunday estimated damages as high as \$11 billion for insured homes alone...
tech	A 3D hologram technique could transform how experts spot forged signatures and other handwritten documents.
world	BAGHDAD (Reuters) - A delegation of Iraqi political and religious leaders flew out of Baghdad on U.S. military helicopters Tuesday, heading for Najaf in a bid to end a bloody Shi'ite uprising, delegates said.
world	Shiite cleric Moqtada Sadr signaled that he would accept pleas to dissolve his militia and vacate the sacred Imam Ali shrine in Najaf, but asked for time for further negotiations.
world	The family of the murdered journalist Daniel Pearl has appealed to American politicians not to use his name in their election campaigns.
world	ISLAMABAD, Pakistan : Aug 18 (PID) - The outgoing Ambassador of Qatar, Mr. Abdullah Falah A. Al-Dosari paid a courtesy called on the President General Pervez Musharraf here on Tuesday.
business	US officials dismiss claims of tax evasion levelled at watchmaker Swatch by two former employees.
world	Southern African leaders have agreed to a set of rules aimed at enhancing the transparency of elections and democratic rule in the region.
world	SAN JOSE, California - On the cusp of its voyage into public trading, Google's initial stock price was set at \$85 and its market value calculated at \$23 billion - less than originally expected, but still impressive for a 6-year-old dot-com dreamed up in a garage. The final initial public offering price, set through an unorthodox auction that alienated many on Wall Street, means the stock will likely debut Thursday under the symbol "GOOG" on the Nasdaq Stock Market...
tech	\\A few days ago Kerry sent around this ad:\\"Yesterday, the Bush-Cheney campaign, losing any last sense of decency, placed\a disgusting ad called "The Faces of John Kerry's Democratic Party" as the\main feature on its website. Bizarrely, and without explanation, the ad places\Adolf Hitler among those faces."\\"The Bush-Cheney campaign must pull this ad off of its website. The use of\Adolf Hitler by any campaign, politician or party is simply wrong."\\Which of course is a mistake. I went and downloaded the video (which is just\stupid btw. Not a masterpiece by any means.) and there are shots of Hitler in\there, but only from the MoveOn contest from a few months back.\\Here's the problem. The ...\\
business	Today's customers are increasingly demanding, in Asia as elsewhere in the world. Henry Astorga describes the complex reality faced by today's marketers, which includes much higher expectations than we have been used to. Today's customers want performance, and they want it now!
world	Mohamed Yousif, Sudans minister of humanitarian affairs, dismissed widespread assertions of government involvement in a vicious militia campaign against civilians in the western region.
world	VADUZ, Liechtenstein (Reuters) - The people of Liechtenstein ushered in a new era Sunday as the tiny Alpine principality welcomed a new ruler and sought to shed its image as a haven for money launderers.
tech	\\Zawodny threads off of Scoble on the IE issue:\\"I have to say, when I first read that I nearly fell off my chair laughing. I was\thinking "how stupid ARE these IE guys?!?!?!" But we all know that Microsoft is\full of smart people who care about what they're doing. So something really\doesn't compute here."\\"Last time I checked, IE wasn't even close to feature parity with Mozilla's\browsers. No popup blocking, no tabbed browsing, etc."\\"Does the IE team really not know what their product is missing?"\\Perhaps. It's highly likely that they just don't know.\\The bigger issue here is that Microsoft products can't fail and they can't\succeed. Microsoft has 40-50 billion in the bank. There ...\\
world	Here in the Gion geisha district of Japan's ancient capital, even one bad hair day can cost a girl her career. So it is no wonder that Tetsuo Ishihara is the man with the most popular hands in town.
world	Former super flyweight boxing champion Robert Quiroga has been stabbed to death in San Antonio, Texas.
world	The next few weeks may reveal whether or not Prime Minister Sharon will succeed in cobbling together a government that will implement his Gaza withdrawal plan. It is disconcerting to see how difficult he is finding it to ...
world	Phish made its farewell in Vermont this past weekend in true Phish style: playing its own musical marathon, swarmed by adoring fans and isolated from the rest of the world.
business	Post staff writer David Hilzenrath and editor Mike Flagg discuss which local executives have the sweetest deals.
business	ATLANTA (Reuters) - Home Depot Inc. &lt;A HREF="http://www.investor.reuters.com/FullQuote.aspx?ticker=HD.N target=/stocks/quickinfo/fullquote"&gt;HD.N&lt;/A&gt;, the world's largest home improvement retailer, on Tuesday said quarterly profit rose, topping estimates, as technology upgrades and other store improvements helped boost sales.
world	JERUSALEM (Reuters) - Israeli Prime Minister Ariel Sharon has vowed to press ahead with his Gaza pullout plan despite a humiliating rebuff from his own party of his bid to forge a coalition with the pro-withdrawal Labour Party.
world	JERUSALEM - Israeli Prime Minister Ariel Sharon has approved bids for construction of 1,000 homes in Jewish West Bank settlements after freezing them earlier this month, amid growing friction with the United States over continued settlement expansion. The planned construction violates the internationally backed "road map" plan, accepted by Israel, which calls for a construction freeze...
world	Aug. 18 (Bloomberg) -- Road traffic to Nepal #39;s capital, Kathmandu, stopped as communist rebels began a blockade of the city to demand the release of insurgents, Reuters reported.
world	In a bombproof building, surrounded by police carrying sub-machine guns, the eight men charged with plotting chemical or radioactive attacks in Britain and the United States made their first appearance in court yesterday since their arrest ...
world	JERUSALEM - The Israeli man at the center of New Jersey Gov. James E...
world	BEIJING, Aug 18 (Reuters) - China said on Wednesday it hoped all six parties taking part in talks on the North Korea nuclear crisis would keep calm, remain flexible and continue negotiations despite inevitable difficulties.
world	AP - A bomb exploded during an Independence Day parade in India's remote northeast Sunday, killing at least 15 people, including schoolchildren, while a rocket attack during a celebration at a school in the separatist region of Kashmir injured 17, officials said.
world	AFP - US national security advisory Condoleezza Rice said that US military power on the Korean peninsula will be stronger even if 12,000 troops are withdrawn under a controversial troop withdrawal plan.
world	KHARTOUM, Sudan (Reuters) - Villagers returning to their homes in Sudan's Darfur region are living in fear of the Arab militiamen who initially drove them away, the United Nations said in a report received by Reuters Monday.
world	ATHENS, Greece - In an upset that was as historic as it was inevitable, the U.S. men's basketball team lost for only the third time ever in the Olympics on Sunday, 92-73 to Puerto Rico...
business	NEW YORK (Reuters) - Sysco Corp. &lt;SYY.N&gt;, the largest U.S. distributor of food to restaurants and hospitals, on Monday said quarterly profit rose as an extra week in the period and acquisitions helped offset the effects of higher food prices.
world	Switzerland is to hand back to Nigeria SFr622 million (\$500 million) belonging to the former ruler, Sani Abacha, and his family.
world	A bird species new to science is found by researchers on a remote island in the Philippines.
world	Reuters - Illinois residents will soon gain\access to lower-cost prescription drugs from Canada, the United\Kingdom and Ireland, sidestepping U.S. regulators' objections\to imported drugs, Gov. Rod Blagojevich said on Tuesday.
world	A 42-year-old man is charged with killing a former miner who was found on his Nottinghamshire doorstep.
world	PUNTA GORDA, Fla. - Bill Nylander survived Hurricane Charley, but the storm still managed to hurt him days after it cut a swath of destruction through his hometown...
business	Autodesk this week unwrapped an updated version of its hosted project collaboration service targeted at the construction and manufacturing industries. Autodesk Buzzsaw lets multiple, dispersed project participants -- including building owners, developers, architects, construction teams, and facility managers -- share and manage data throughout the life of a project, according to Autodesk officials.
world	Foreign Minister Alexander Downer has offered an up-beat assessment at the end of talks in Pyongyang about the North Korean nuclear crisis.
world	Residents of Boscastle are counting the cost today of the damage estimated at millions of pounds caused by a freak downpour.
world	NEW YORK - Buyers put a positive spin on equities Wednesday, shrugging off rising crude futures as Google Inc. prepared to sell its stock in an initial public offering, albeit it at a far lower price than previously forecast...
world	DAR ES SALAAM - African leaders on Wednesday declared quot;a terrorist organisation quot; the rebels who claimed the slaughter of at least 160 Congolese Tutsi refugees in Burundi, but failed to impose sanctions on their group.
world	ATHENS, Greece - Top American sprinters Jason Lezak and Ian Crocker missed the cut in the Olympic 100-meter freestyle preliminaries Tuesday, a stunning blow for a country that had always done well in the event. Pieter van den Hoogenband of the Netherlands and Australian Ian Thorpe advanced to the evening semifinal a day after dueling teenager Michael Phelps in the 200 freestyle, won by Thorpe...
business	LONDON (Reuters) - Oil prices eased from new record highs on Monday as victory for Venezuelan President Hugo Chavez in a referendum on his rule eased fears that unrest could upset the country's oil exports.
world	Police in Burundi #39;s capital Bujumbura fired tear gas at crowds today, protesting against the massacre of at least 160 Congolese Tutsis at a UN refugee camp in the west of the country.
business	NEW YORK (Reuters) - Department store operator J.C. Penney Co. Inc. &lt;A HREF="http://www.investor.reuters.com/FullQuote.aspx?ticker=JCP.N target=/stocks/quickinfo/fullquote"&gt;JCP.N&lt;/A&gt; on Tuesday posted a second-quarter profit, reversing a year-earlier loss, helped by inventory controls and strong department store sales.
world	NAGDHUNGA, Nepal (Reuters) - Maoist rebels, fighting to topple Nepal's constitutional monarchy, cut off all land routes to the Himalayan kingdom's capital on Wednesday, disrupting food and supplies to the city of 1.5 million people.
tech	Reuters - A group of technology companies\including Texas Instruments Inc. (TXN.N), STMicroelectronics\(STM.PA) and Broadcom Corp. (BRCM.O), on Thursday said they\will propose a new wireless networking standard up to 10 times\the speed of the current generation.
tech	A protein which helps increase lifespan in worms offers hope for new Parkinson's and Alzheimer's treatments.
world	WASHINGTON - Increasing numbers of National Guard and Reserve troops who have returned from war in Iraq and Afghanistan are encountering new battles with their civilian employers at home. Jobs were eliminated, benefits reduced and promotions forgotten...
world	GATUMBA, Burundi (Reuters) - Mourners covered their faces to block the smell of disinfectant and death Monday as they buried more than 160 Congolese Tutsi refugees burned, hacked and shot in an attack on their camp in western Burundi.
business	Reuters - Lowe's Cos. (LOW.N), the second-largest\home improvement retailer behind Home Depot Inc. (HD.N), on\Monday said quarterly profit rose, but trailed estimates.
world	ATHENS, Greece - Andy Roddick hit one last errant shot into the net and hung his head, his medal hopes over. A short while later, Venus Williams was gone, too...
world	German Chancellor Gerhard Schroeder confirmed on Wednesday that he and his wife have adopted a child, reported to be a girl from a Russian orphanage, but has called on the media to respect his family #39;s privacy.
